<?xml version="1.0" encoding="UTF-8"?>

<monster:monster xmlns:monster="http://www.swordsandsorcery.com/monster"
                 xmlns:xsi="http://www.w3.org/2001/XMLSchema-instance"
                 xsi:schemaLocation="http://www.swordsandsorcery.com/monster ../schema.xsd">
    <monster:id>35</monster:id>
    <monster:name>Skeleton Brute</monster:name>
    <monster:type>UNDEAD</monster:type>
    <monster:subtype>SKELETON</monster:subtype>
    <monster:health>45</monster:health>
    <monster:mana>0</monster:mana>
    <monster:initiation>
        <monster:value>24</monster:value>
    </monster:initiation>
    <monster:level>17</monster:level>
    <monster:defense>26</monster:defense>
    <monster:damage>
        <monster:value>2</monster:value>
        <monster:d6>1</monster:d6>
    </monster:damage>
    <monster:attack>
        <monster:value>24</monster:value>
        <monster:d4>1</monster:d4>
        <monster:d6>3</monster:d6>
    </monster:attack>
    <monster:aiming>
        <monster:value>0</monster:value>
    </monster:aiming>
    <monster:ranged-damage>
        <monster:value>0</monster:value>
    </monster:ranged-damage>
    <monster:magic-attack>
        <monster:value>0</monster:value>
    </monster:magic-attack>
    <monster:magic-damage>
        <monster:value>0</monster:value>
    </monster:magic-damage>
    <monster:spell-resistance>22</monster:spell-resistance>
    <monster:attack-type>MELEE</monster:attack-type>
    <!-- TODO: Drops! -->
</monster:monster>