<?xml version="1.0" encoding="UTF-8"?>

<monster:monster xmlns:monster="http://www.swordsandsorcery.com/monster"
                 xmlns:xsi="http://www.w3.org/2001/XMLSchema-instance"
                 xsi:schemaLocation="http://www.swordsandsorcery.com/monster ../schema.xsd">
    <monster:id>11</monster:id>
    <monster:name>Gnoll</monster:name>
    <monster:health>22</monster:health>
    <monster:mana>0</monster:mana>
    <monster:initiation>
        <monster:value>22</monster:value>
    </monster:initiation>
    <monster:level>9</monster:level>
    <monster:defense>21</monster:defense>
    <monster:damage>
        <monster:value>2</monster:value>
        <monster:d6>1</monster:d6>
    </monster:damage>
    <monster:attack>
        <monster:value>24</monster:value>
        <monster:d6>1</monster:d6>
    </monster:attack>
    <monster:aiming>
        <monster:value>0</monster:value>
    </monster:aiming>
    <monster:ranged-damage>
        <monster:value>0</monster:value>
    </monster:ranged-damage>
    <monster:magic-attack>
        <monster:value>0</monster:value>
    </monster:magic-attack>
    <monster:magic-damage>
        <monster:value>0</monster:value>
    </monster:magic-damage>
    <monster:spell-resistance>0</monster:spell-resistance>
    <monster:attack-type>MELEE</monster:attack-type>
    <monster:droplist>
        <monster:drop>
            <monster:item>111</monster:item>
            <monster:amount>
                <monster:max>1</monster:max>
            </monster:amount>
            <monster:chance>4</monster:chance>
        </monster:drop>
        <monster:drop>
            <monster:item>101</monster:item>
            <monster:amount>
                <monster:max>1</monster:max>
            </monster:amount>
            <monster:chance>0.4</monster:chance>
        </monster:drop>
        <monster:drop>
            <monster:item>103</monster:item>
            <monster:amount>
                <monster:max>1</monster:max>
            </monster:amount>
            <monster:chance>0.4</monster:chance>
        </monster:drop>
        <monster:drop>
            <monster:item>105</monster:item>
            <monster:amount>
                <monster:max>1</monster:max>
            </monster:amount>
            <monster:chance>0.4</monster:chance>
        </monster:drop>
        <monster:drop>
            <monster:item>107</monster:item>
            <monster:amount>
                <monster:max>1</monster:max>
            </monster:amount>
            <monster:chance>0.4</monster:chance>
        </monster:drop>
        <monster:drop>
            <monster:item>109</monster:item>
            <monster:amount>
                <monster:max>1</monster:max>
            </monster:amount>
            <monster:chance>0.4</monster:chance>
        </monster:drop>
        <monster:drop>
            <monster:item>100</monster:item>
            <monster:amount>
                <monster:max>1</monster:max>
            </monster:amount>
            <monster:chance>0.1</monster:chance>
        </monster:drop>
        <monster:drop>
            <monster:item>102</monster:item>
            <monster:amount>
                <monster:max>1</monster:max>
            </monster:amount>
            <monster:chance>0.2</monster:chance>
        </monster:drop>
        <monster:drop>
            <monster:item>104</monster:item>
            <monster:amount>
                <monster:max>1</monster:max>
            </monster:amount>
            <monster:chance>0.2</monster:chance>
        </monster:drop>
        <monster:drop>
            <monster:item>106</monster:item>
            <monster:amount>
                <monster:max>1</monster:max>
            </monster:amount>
            <monster:chance>0.2</monster:chance>
        </monster:drop>
        <monster:drop>
            <monster:item>108</monster:item>
            <monster:amount>
                <monster:max>1</monster:max>
            </monster:amount>
            <monster:chance>0.2</monster:chance>
        </monster:drop>
        <monster:drop>
            <monster:item>110</monster:item>
            <monster:amount>
                <monster:max>1</monster:max>
            </monster:amount>
            <monster:chance>0.2</monster:chance>
        </monster:drop>
        <monster:drop>
            <monster:item>1</monster:item>
            <monster:amount>
                <monster:min>10</monster:min>
                <monster:max>30</monster:max>
            </monster:amount>
            <monster:chance>40</monster:chance>
        </monster:drop>
        <monster:drop>
            <monster:item>99</monster:item>
            <monster:amount>
                <monster:max>1</monster:max>
            </monster:amount>
            <monster:chance>0.05</monster:chance>
        </monster:drop>
        <monster:drop>
            <monster:item>84</monster:item>
            <monster:amount>
                <monster:max>1</monster:max>
            </monster:amount>
            <monster:chance>1</monster:chance>
        </monster:drop>
        <monster:drop>
            <monster:item>77</monster:item>
            <monster:amount>
                <monster:max>1</monster:max>
            </monster:amount>
            <monster:chance>1</monster:chance>
        </monster:drop>
        <monster:drop>
            <monster:item>75</monster:item>
            <monster:amount>
                <monster:max>1</monster:max>
            </monster:amount>
            <monster:chance>2</monster:chance>
        </monster:drop>
        <monster:drop>
            <monster:item>72</monster:item>
            <monster:amount>
                <monster:max>1</monster:max>
            </monster:amount>
            <monster:chance>2</monster:chance>
        </monster:drop>
        <monster:drop>
            <monster:item>12</monster:item>
            <monster:amount>
                <monster:max>1</monster:max>
            </monster:amount>
            <monster:chance>1</monster:chance>
        </monster:drop>
    </monster:droplist>
    <monster:scavengelist>
        <monster:drop>
            <monster:item>100</monster:item>
            <monster:amount>
                <monster:max>1</monster:max>
            </monster:amount>
            <monster:chance>0.1</monster:chance>
        </monster:drop>
        <monster:drop>
            <monster:item>102</monster:item>
            <monster:amount>
                <monster:max>1</monster:max>
            </monster:amount>
            <monster:chance>0.2</monster:chance>
        </monster:drop>
        <monster:drop>
            <monster:item>104</monster:item>
            <monster:amount>
                <monster:max>1</monster:max>
            </monster:amount>
            <monster:chance>0.2</monster:chance>
        </monster:drop>
        <monster:drop>
            <monster:item>106</monster:item>
            <monster:amount>
                <monster:max>1</monster:max>
            </monster:amount>
            <monster:chance>0.2</monster:chance>
        </monster:drop>
        <monster:drop>
            <monster:item>108</monster:item>
            <monster:amount>
                <monster:max>1</monster:max>
            </monster:amount>
            <monster:chance>0.2</monster:chance>
        </monster:drop>
        <monster:drop>
            <monster:item>110</monster:item>
            <monster:amount>
                <monster:max>1</monster:max>
            </monster:amount>
            <monster:chance>0.2</monster:chance>
        </monster:drop>
        <monster:drop>
            <monster:item>99</monster:item>
            <monster:amount>
                <monster:max>1</monster:max>
            </monster:amount>
            <monster:chance>0.1</monster:chance>
        </monster:drop>
        <monster:drop>
            <monster:item>84</monster:item>
            <monster:amount>
                <monster:max>1</monster:max>
            </monster:amount>
            <monster:chance>1</monster:chance>
        </monster:drop>
        <monster:drop>
            <monster:item>77</monster:item>
            <monster:amount>
                <monster:max>1</monster:max>
            </monster:amount>
            <monster:chance>1</monster:chance>
        </monster:drop>
        <monster:drop>
            <monster:item>75</monster:item>
            <monster:amount>
                <monster:max>1</monster:max>
            </monster:amount>
            <monster:chance>2</monster:chance>
        </monster:drop>
        <monster:drop>
            <monster:item>72</monster:item>
            <monster:amount>
                <monster:max>1</monster:max>
            </monster:amount>
            <monster:chance>2</monster:chance>
        </monster:drop>
        <monster:drop>
            <monster:item>12</monster:item>
            <monster:amount>
                <monster:max>1</monster:max>
            </monster:amount>
            <monster:chance>2</monster:chance>
        </monster:drop>
    </monster:scavengelist>
</monster:monster>